Learning Area,Subject,Pathway,Sequence,Level,Achievement Standard
The Arts,Dance,,,Years 1 and 2,"<p>By the end of Year 2, students identify where they experience dance. They describe where, why and/or how people across cultures, communities and/or other contexts experience dance.</p>
<p>Students use the elements of dance to structure dance sequences. They demonstrate fundamental movement skills and safe dance practice. They perform their dance in informal settings.</p>"
The Arts,Dance,,,Years 3 and 4,"<p>By the end of Year 4, students describe use of the elements of dance in dance they experience, create and/or perform. They describe where, why and/or how dance is choreographed and/or performed across cultures, times, places and/or other contexts.</p><p>Students use the elements of dance to structure dance sequences that communicate ideas, perspectives and/or meaning. They demonstrate fundamental movement skills and safe dance practice. They perform their dance in informal settings.</p>"
The Arts,Dance,,,Years 5 and 6,"<p>By the end of Year 6, students explain how the elements of dance are used in dance that they choreograph, perform and/or experience. They describe how dance from across cultures, times, places and/or other contexts communicates ideas, perspectives and/or meaning. They describe how dance is used to continue and revitalise cultures.</p><p>Students use the elements of dance and/or choreographic devices to choreograph dances that communicate ideas, perspectives and/or meaning. They demonstrate safe dance practice and use of technical, and expressive skills. They perform dances in informal and/or formal settings.</p>"
The Arts,Dance,,,Years 7 and 8,"<p>By the end of Year 8, students analyse how the elements of dance, choreographic devices and/or production elements are manipulated in dance they create and/or experience. They evaluate the ways that dance works and/or performances in a range of styles and/or from across cultures, times, places and/or other contexts communicate ideas, perspectives and/or meaning. They describe respectful approaches to creating, performing and/or responding to dance.</p><p>Students manipulate the elements of dance and choreographic devices to choreograph dance that communicate ideas, perspectives and/or meanings. They demonstrate safe dance practice when choreographing and performing dance. They employ technical and expressive skills and, as appropriate, genre- or style-specific techniques when performing dances for audiences.</p>"
The Arts,Dance,,,Year 9 and 10,"<p>By the end of Year 10, students analyse how and/or why the elements of dance, choreographic devices, genre- or style-specific techniques, production elements, and/or technical and expressive skills are manipulated in dance they create and/or experience. They evaluate how dance works and/or performances in a range of styles and/or from across cultures, times, places and/or other contexts communicate ideas, perspectives and/or meaning. They evaluate how dance is used to celebrate and challenge perspectives of Australian identity.</p>
<p>Students select and manipulate the elements of dance, choreographic devices and/or structure to choreograph dances. They demonstrate safe dance practice when choreographing and performing dance. They employ technical and expressive skills and genre- or style-specific techniques to enhance communication of ideas, perspectives and/or meaning when performing dance for audiences.</p>"
The Arts,Drama,,,Years 1 and 2,"<p>By the end of Year 2, students identify where they experience drama. They describe where, why and/or how people across cultures, communities and/or other contexts experience drama.</p> <p>Students pretend and imagine as they create roles and situations in improvised drama and/or dramatic play. They perform their drama in informal settings.</p>"
The Arts,Drama,,,Years 3 and 4,"<p>By the end of Year 4, students describe use of selected elements of drama in drama they experience, create and/or perform. TThey describe where, why and/or how drama is created and/or performed across cultures, times, places and/or other contexts.</p><p>Students use selected elements of drama when creating drama and/or performing. They collaborate to improvise and/or devise drama that communicates ideas, perspectives and/or meaning. They perform their work in informal settings.</p>"
The Arts,Drama,,,Years 5 and 6,"<p>By the end of Year 6, students explain how the elements of drama are used in drama they create, perform and/or experience. They describe how drama created and/or performed across cultures, times, places and/or other contexts communicates ideas, perspectives and/or meaning. They describe how drama is used to continue and revitalise cultures.</p>
<p>Students work collaboratively as they combine elements of drama to shape and sustain dramatic action. They improvise and/or devise drama and/or interpret scripts. They perform their drama in informal and/or formal settings.</p>"
The Arts,Drama,,,Years 7 and 8,"<p>By the end of Year 8, students analyse how elements of drama and/or conventions are manipulated in drama they create and/or experience. They evaluate the ways drama created and/or performed across cultures, times, places and/or other contexts communicates ideas, perspectives and/or meaning. They describe respectful approaches to creating, performing and/or responding to drama.</p> <p>Students work collaboratively to manipulate elements of drama and conventions to shape and sustain dramatic action in improvised, devised and/or scripted drama. They employ performance skills to convey dramatic action and communicate ideas, perspectives and/or meaning when performing drama to audiences.</p>"
The Arts,Drama,,,Year 9 and 10,"<p>By the end of Year 10, students analyse how and why the elements of drama, performance skills and/or conventions are manipulated in drama they create, perform and/or experience. They evaluate how drama in a range of styles and/or from a range of contexts communicates ideas, perspectives and/or meaning. They evaluate how drama is used to celebrate and challenge perspectives of Australian identity.</p>
<p>Students work individually and/or collaboratively to shape and manipulate use of the elements of drama, conventions and/or dramatic structures to?communicate ideas, perspectives and/or meaning. They use performance skills relevant to style and/or form to sustain belief, roles and characters in performances of improvised, devised and/or scripted drama for audiences.</p>"
The Arts,,,,Foundation Year,"By the end of the Foundation year, students describe experiences, observations, ideas and/or feelings about arts works they encounter at school, home and/or in the community.

Students use play, imagination, arts knowledge, processes and/or skills to create and share arts works in different forms."
The Arts,Media Arts,,,Years 1 and 2,"<p>By the end of Year 2, students identify where they experience media arts. They describe where, why and/or how people across cultures, communities and/or other contexts experience media arts.</p>
<p>Students use media languages and media technologies to construct representations in media arts works. They share their work with audiences safely and in informal ways.</p>"
The Arts,Media Arts,,,Years 3 and 4,"<p>By the end of Year 4, students describe the use of media languages and media technologies to construct representations in media arts works they experience and/or produce. They describe where, why and/or how media arts works are created and/or distributed across cultures, times, places, and/or other contexts.</p>
<p>Students use media languages, and media technologies and production processes to construct representations in media arts works. They share their work in informal settings using responsible media practice.</p>"
The Arts,Media Arts,,,Years 5 and 6,"<p>By the end of Year 6, students explain how media languages and media technologies are used in media arts works they construct and/or experience. They describe how media arts works created across cultures, times, places and/or other contexts communicate ideas, perspectives and/or meanings. They describe how media arts can be used to continue and revitalise cultures.</p>
<p>Students use media languages, and media technologies and production processes to construct representations in media arts works for specific purposes and audiences. They present their work in informal and/or formal settings using responsible media practice.</p>"
The Arts,Media Arts,,,Years 7 and 8,"<p>By the end of year 8, students analyse the use of media arts concepts to construct representations that communicate ideas, perspectives and/or meaning in media arts works they produce and/or experience. They evaluate use of media arts concepts in media arts works from across cultures, times, places and/or other contexts. They describe respectful approaches to creating and/or responding to media arts works.</p> <p>Students select and manipulate media languages, media technologies and use production processes to construct representations. They create media arts works that communicate ideas, perspectives and/or meanings. They present their work to an audience. They plan where and how they could distribute their work using responsible media practice.</p>"
The Arts,Media Arts,,,Year 9 and 10,"<p>By the end of Year 10, students analyse how and why media arts concepts are manipulated to construct representations in media arts works they produce and/or experience. They evaluate how and why media artists across cultures, times, places and/or other contexts use media arts concepts to represent and/or challenge ideas, perspectives and/or meaning. They evaluate how media arts are used to celebrate and challenge perspectives of Australian identity.</p>
<p>Students use media arts concepts to construct representations and communicate ideas, perspectives and/or meaning. They use responsible media practice and production processes to create media arts works in a range of genres/styles and/or forms, for specific audiences. They present their work to an audience. They plan where and how they could distribute their work and the relationships they could develop with their audiences, using responsible media practice.</p>"
The Arts,Music,,,Years 1 and 2,"<p>By the end of Year 2, students identify where they experience music. They describe where, why and/or how people across cultures, communities and/or other contexts experience music.</p>
<p>Students demonstrate listening skills. They use the elements of music to improvise and/or compose music. They sing and play music in informal settings.</p>"
The Arts,Music,,,Years 3 and 4,"<p>By the end of Year 4, students describe the use of elements of music in music they compose, perform and/or experience. They describe where, why and/or how music is composed and/or performed across cultures, times, places and/or other contexts.</p><p>Students demonstrate listening skills when performing and composing. They combine the elements of music to compose music that communicates ideas. They sing and play music in informal settings.</p>"
The Arts,Music,,,Years 5 and 6,"<p>By the end of Year 6, students explain how elements of music are manipulated in music they compose, perform and/or experience. They describe how music composed and/or performed across contexts, cultures, times and/or places communicates ideas, perspectives and/or meanings. They describe how music is used to continue and/or revitalise cultures.</p>
<p>Students demonstrate listening and aural skills when composing and performing. They use elements of music and compositional devices to compose music that communicates ideas. They notate, document and/or record the music. They perform music in formal and/or informal settings.</p>"
The Arts,Music,,,Years 7 and 8,"<p>By the end of Year 8, students analyse how the elements of music and/or compositional devices are manipulated in music they compose, perform and/or experience. They evaluate the ways music from across cultures, times, places and/or other contexts communicates ideas, perspectives and/or meaning. They describe respectful approaches to composing, performing and/or responding to music.</p><p>Students demonstrate listening and aural skills when composing and performing. They manipulate elements of music and compositional devices to compose music that communicates ideas, perspectives and/or meaning. They notate, document and/or record the music they compose. They manipulate elements of music when performing their own and/or others’ music. They demonstrate performance skills when performing music for audiences.</p>"
The Arts,Music,,,Year 9 and 10,"<p>By the end of Year 10, students analyse ways composers and/or performers use the elements of music and compositional devices to engage audiences. They evaluate how music and/or performances in a range of styles and/or from across cultures, times, places and/or other contexts communicate ideas, perspectives and/or meaning. They evaluate how music is used to celebrate and challenge perspectives of Australian identity.</p>
<p>Students?demonstrate listening and aural skills relevant to the styles and/or contexts in which they are working. Students?manipulate elements of music and use compositional devices to communicate ideas, perspectives and/or meaning in compositions in selected style/s, form/s and/or using selected instrumentation. They notate, document and/or record their music. They apply knowledge of styles and/or forms when performing their own and/or others’ music. They demonstrate appropriate vocal and/or instrumental techniques and performance skills when performing music for audiences.</p>"
The Arts,Visual Arts,,,Years 1 and 2,"<p>By the end of Year 2, students identify where they experience visual arts. They describe where, why and/or how people across cultures, communities and/or other contexts experience visual arts.</p>
<p>Students experiment with visual conventions, visual arts processes and materials. They make and share artworks in informal settings.</p>"
The Arts,Visual Arts,,,Years 3 and 4,"<p>By the end of Year 4, students describe the use of visual conventions, visual arts processes and materials in artworks they create and/or experience. They describe where, why and/or how visual artists create and/or display artworks across cultures, times, places and/or other contexts.</p> <p>Students use visual conventions, visual arts processes and materials to create artworks that communicate ideas, perspectives and/or meaning. They share or display their artworks and/or visual arts practice in informal settings.</p>"
The Arts,Visual Arts,,,Years 5 and 6,"<p>By the end of Year 6, students explain the ways that visual conventions, visual arts processes and materials are used in artworks they create and/or experience. They describe how artworks created across cultures, times, places and/or other contexts communicate ideas, perspectives and/or meaning. They describe how visual arts are used to continue and revitalise cultures.</p>
<p>Students develop and document ideas for their own artworks. They select and use visual conventions, visual arts processes and materials to create artworks that communicate ideas, perspectives and/or meaning. They present documentation and artworks that communicate ideas, perspectives or meaning in informal and/or formal settings.</p>"
The Arts,Visual Arts,,,Years 7 and 8,"<p>By the end of Year 8, students analyse how visual conventions, visual arts processes and materials are manipulated in artworks they create and/or experience. They evaluate the ways that visual artists across cultures, times, places and/or other contexts communicate ideas, perspectives and/or meaning through their visual arts practice. They describe respectful approaches to creating and/or responding to artworks.</p>
<p>Students generate, document and develop ideas for artworks. They reflect on their visual arts practice. They select and manipulate visual conventions, visual arts processes and/or materials to create artworks that represent ideas, perspectives and/or meaning. They curate and present exhibits and/or displays of their own and/or others’ artworks and/or visual arts practice for audiences.</p>"
The Arts,Visual Arts,,,Year 9 and 10,"<p>By the end of Year 10, students analyse how and why visual conventions, visual arts processes and materials are manipulated in artworks they create and/or experience. They evaluate how and why artists from across cultures, times, places and/or other contexts use visual conventions, visual arts processes and materials in their visual arts practice and/or artworks to represent and/or challenge ideas, perspectives and/or meaning. They evaluate how visual arts are used to celebrate and challenge perspectives of Australian identity.</p>
<p>Students draw on inspiration from multiple sources to generate and develop ideas for artworks. They document and reflect on their own visual arts practice. They use knowledge of visual conventions, visual arts processes and materials to create artworks that represent and/or communicate ideas, perspectives and/or meaning. They curate and present exhibitions of their own and or/others’ artworks and visual arts practice to engage audiences.</p>"
The Arts,,,,Years 1 and 2,"<p>By the end of Year 2, students identify where they experience the arts. They describe where, why and/or how people across cultures, communities and/or other contexts experience the arts.</p>
<p>Students demonstrate arts practices and skills across arts subjects. They create arts works in a range of forms. They share their work in informal settings.</p>"
The Arts,,,,Years 3 and 4,"<p>By the end of Year 4, students describe use of elements, concepts and/or conventions in arts works they create and/or experience. They describe where, why and/or how arts works are created and presented across cultures, times, places, and/or other contexts.</p>
<p>Students use arts knowledge and skills to create arts works in a range of forms that communicate ideas, perspectives and/or meaning. They present and/or perform their work in informal settings.</p>"
The Arts,,,,Years 5 and 6,"<p>By the end of Year 6, students explain the use of elements, concepts and/or conventions in arts works they create and/or experience. They describe how the arts communicate ideas, perspectives and/or meaning across cultures, times, places and/or other contexts. They describe how the arts are used to continue and revitalise cultures.</p>
<p>Students use subject-specific knowledge, elements, concepts, conventions, materials, skills and/or processes to create arts works that communicate ideas, perspectives and/or meaning. They demonstrate safe practices. They present and perform their arts works in formal and/or informal settings.</p>"
English,English,,,Foundation Year,"<p>By the end of Foundation, students listen to texts, interact with others and create short spoken texts, including retelling stories. They share thoughts and preferences, retell events and report information or key ideas to an audience. They use language features including words and phrases from learning and texts. They listen for and identify rhymes, letter patterns and sounds (phonemes) in words. They orally blend and segment phonemes in single-syllable words.</p>
<p>They read, view and comprehend texts, making connections between characters, settings and events, and to personal experiences. They identify the language features of texts including connections between print and images. They name the letters of the English alphabet and know and use the most common sounds (phonemes) represented by these letters (graphs). They read words including consonant–vowel–consonant words and some high-frequency words.</p>
<p>They create short written texts, including retelling stories using words and images where appropriate. They retell, report information and state their thoughts, feelings and key ideas. They use words and phrases from learning and texts. They form letters, spell most consonant–vowel–consonant words and experiment with capital letters and full stops.</p>"
English,English,,,Year 1,"<p>By the end of Year 1, students interact with others, and listen to and create short spoken texts including recounts of stories. They share ideas and retell or adapt familiar stories, recount or report on events or experiences, and express opinions using a small number of details from learnt topics, topics of interest or texts. They sequence ideas and use language features including topic-specific vocabulary and features of voice.</p>
<p>They read, view and comprehend texts, monitoring meaning and making connections between the depiction of characters, settings and events, and to personal experiences. They identify the text structures of familiar narrative and informative texts, and their language features and visual features. They blend short vowels, common long vowels, consonants and digraphs to read one-syllable words. They read one- and two-syllable words with common letter patterns, and an increasing number of high-frequency words. They use sentence boundary punctuation to read with developing phrasing and fluency.</p>
<p>They create short written and/or multimodal texts including recounts of stories with events and characters. They report information and experiences, and express opinions. Ideas in their texts may be informative or imaginative and include a small number of details from learnt topics, topics of interest or texts. They write simple sentences with sentence boundary punctuation and capital letters for proper nouns. They use topic-specific vocabulary. They write words using unjoined upper-case and lower-case letters. They spell most one- and two-syllable words with common letter patterns and common grammatical morphemes, and an increasing number of high-frequency words.</p>"
English,English,,,Year 2,"<p>By the end of Year 2, students interact with others, and listen to and create spoken texts including stories. They share ideas, topic knowledge and appreciation of texts when they recount, inform or express an opinion, including details from learnt topics, topics of interest or texts. They organise and link ideas, and use language features including topic-specific vocabulary and features of voice.</p>
<p>They read, view and comprehend texts, identifying literal and inferred meaning, and how ideas are presented through characters and events. They describe how similar topics and information are presented through the structure of narrative and informative texts, and identify their language features and visual features. They use phonic and morphemic knowledge, and grammatical patterns to read unfamiliar words and most high-frequency words. They use punctuation for phrasing and fluency.</p>
<p>They create written and/or multimodal texts including stories to inform, express an opinion, adapt an idea or narrate for audiences. They use text structures to organise and link ideas for a purpose. They punctuate simple and compound sentences. They use topic-specific vocabulary. They write words using consistently legible unjoined letters. They spell words with regular spelling patterns, and use phonic and morphemic knowledge to attempt to spell words with less common patterns.</p>"
English,English,,,Year 3,"<p>By the end of Year 3, students interact with others, and listen to and create spoken and/or multimodal texts including stories. They relate ideas; express opinion, preferences and appreciation of texts; and include relevant details from learnt topics, topics of interest or texts. They group, logically sequence and link ideas. They use language features including topic-specific vocabulary, and/or visual features and features of voice.</p> <p>They read, view and comprehend texts, recognising their purpose and audience. They identify literal meaning and explain inferred meaning. They describe how stories are developed through characters and/or events. They describe how texts are structured and presented. They describe the language features of texts including topic-specific vocabulary and literary devices, and how visual features extend meaning. They read fluently, using phonic, morphemic and grammatical knowledge to read multisyllabic words with more complex letter patterns.</p> They create written and/or multimodal texts, including stories to inform, narrate, explain or argue for audiences, relating ideas including relevant details from learnt topics, topics of interest or texts. They use text structures including paragraphs, and language features including compound sentences, topic-specific vocabulary and literary devices, and/or visual features. They write texts using letters that are accurately formed and consistent in size. They spell multisyllabic words using phonic and morphemic knowledge, and high-frequency words."
